{
  "id": "ga4",
  "name": "Google Analytics 4",
  "version": "1.2.0",
  "developer": "YuvexPay",
  "description": "Envia eventos de compra para o Google Analytics 4 via Measurement Protocol.",
  "icon": "https://cdn.yuvexpay.com/ga4.png",
  "configSchema": {
    "type": "object",
    "properties": {
      "measurementId": {
        "type": "string",
        "title": "Measurement ID",
        "description": "Identificador do fluxo de dados, no formato G-XXXXXXX."
      },
      "apiSecret": {
        "type": "string",
        "title": "API Secret",
        "description": "Segredo da API do Measurement Protocol.",
        "secret": true
      }
    },
    "required": ["measurementId", "apiSecret"]
  },
  "events": ["payment.paid"],
  "scopes": ["data", "tracking"],
  "egress": ["www.google-analytics.com"],
  "actions": [
    {
      "on": "payment.paid",
      "request": {
        "method": "POST",
        "url": "https://www.google-analytics.com/mp/collect?measurement_id={{ config.measurementId }}&api_secret={{ config.apiSecret }}",
        "headers": {},
        "body": {
          "client_id": "{{ event.tracking.gaClientId | fallback:event.customer.id | fallback:event.data.payment.id | ga_client_id }}",
          "ip_override": "{{ event.tracking.clientIp }}",
          "user_agent": "{{ event.tracking.userAgent }}",
          "events": [
            {
              "name": "purchase",
              "params": {
                "transaction_id": "{{ event.data.payment.id }}",
                "currency": "{{ event.data.payment.currency }}",
                "value": "{{ event.data.payment.amountCents | cents_to_decimal }}",
                "engagement_time_msec": 1,
                "items": [
                  {
                    "item_id": "{{ event.data.payment.id }}",
                    "item_name": "{{ event.data.payment.description | fallback:Pagamento YuvexPay }}",
                    "currency": "{{ event.data.payment.currency }}",
                    "price": "{{ event.data.payment.amountCents | cents_to_decimal }}",
                    "quantity": 1
                  }
                ]
              }
            }
          ]
        }
      }
    }
  ]
}
